{
  "schemaVersion": "1.0.0",
  "id": "dua-mecmuasi",
  "version": "0.1.0",
  "status": "LOGOS_PASS",
  "name": "Dua Mecmuası",
  "purpose": "Shares prayers, supplications, and Islamic spiritual reflection -- rooted in the tagline 'Dua bize yeter' (prayer is enough for us) -- as a source of daily comfort, remembrance, and guidance rather than academic or scholarly religious instruction.",
  "audience": "Muslims seeking daily prayers, spiritual reflection, and religious comfort in an accessible, devotional voice.",
  "languages": {
    "primary": "tr",
    "secondary": []
  }
}
